y,y,y,y,m,Dave,Hitz,Founder and EVP,NetApp,"Founder and EVP, NetApp",5,,speaker,y,"As executive vice president, David Hitz is responsible for the future strategy and direction of NetApp. Dave Hitz and James Lau founded NetApp in 1992 with a desire to simplify storage the way Cisco simplified networking. Dave and James believed that general-purpose computing systems were too complex, so they built dedicated devices called appliances. These appliances were designed to handle one thing well: storage. Dave holds a bachelor's degree in computer science and electrical engineering from Princeton University.",x,@davehitz,,http://www.linkedin.com/pub/dave-hitz/7/3aa/a83
y,y,y,y,m,Jason,Hoffman,Founder and Chief Scientist,Joyent,"Founder and Chief Scientist, Joyent",6,,speaker,y,"Jason is the Founder and Chief Scientist at Joyent, and served as its CTO for the company’s first 6 years. Jason’s group is responsible for research and advanced development, technical outreach, evangelism, consultative efforts for partners and business units, and manages Joyent’s intellectual property portfolio including involvement in open source projects, licensing, technology transfer, assessments of potential partnerships, mergers and acquisitions. He was once referred to as a “Renaissance engineer” by ZFS creator Jeff Bonwick, and has always used “computers” to solve real problems. Jason has a BS and MS from UCLA and a PhD from the Burnham Institute and UCSD School of Medicine.",,@jasonh,,http://www.linkedin.com/in/jasonhoffman
y,y,y,y,m,Matthew,Howard,General Partner,Norwest Venture Partners,"General Partner, Norwest Venture Partners",,,speaker,y,"Matt has 20+ years of experience in marketing, product management, engineering, business development, and sales across diverse technologies. He has appeared on the Forbes Midas List as a top 100 investor for three years and holds three patents in mobility and cyber security. Matt focuses on communication and storage systems, cloud, mobile/wireless, security and rich media. He serves on the boards of Avere Systems, Blue Jeans Network, ConteXtream, MobileIron, Retrevo and Summit Microelectronics. Previously, Matt was on the board of Airespace (acquired by Cisco), Omneon (acquired by Harmonic), Reconnex (acquired by McAfee), Skystream Networks (acquired by Tandberg), SpectraLinear (acquired by Silicon Laboratories), Spinnaker Networks (acquired by Network Appliance), Swan Labs (acquired by F5 Networks) and Webstacks (acquired by Extreme Networks). ",,,,
y,y,y,y,m,Luke,"Kanies
",CEO,Puppet Labs,"Founder and CEO, Puppet Labs",,,speaker,y,"Luke is the founder and CEO of Puppet Labs and the founder of the Puppet project. He helped kickstart the devops movement by preaching Infrastructure as Code, and he believes that computers should be used, not managed.",,@puppetmasterd,http://www.facebook.com/luke.kanies,http://www.linkedin.com/in/lukekanies
y,y,y,y,m,John	,Keagy,CEO and Founder,GoGrid,"CEO and Founder, GoGrid",,,speaker,y,"John Keagy is CEO and Founder of GoGrid, a Global Leader in Cloud & Hybrid Infrastructure hosting. Keagy is an Internet infrastructure pioneer, having built and sold several successful Internet service providers since 1991. Keagy drove the early growth of the dedicated server hosting market by introducing multiple firsts, including multiprocessor servers and hosted load balanced server networks. John Keagy's entrepreneurial skills and strategic vision have led GoGrid's rapid growth. The company was twice positioned as a “Visionary” in the Cloud Infrastructure as a Service and Web Hosting Magic Quadrant as well as named to Deloitte's Technology Fast 500 in recognition of its growth (#11 in Silicon Valley and #77 in North America) in previous years.",,,,
y,y,y,y,m,Rich,Lechner,"VP, Cloud and Services Marketing",IBM,"VP, Cloud and Services Marketing, IBM",,,speaker,y,"Rich Lechner is vice president, IBM cloud and services marketing. He has broad experience across the software, systems and services business including key leadership roles in virtualization, Internet technology, Green innovation, and enterprise systems. He is responsible for defining IBM's cloud strategies and portfolio of services leveraging IBM’s deep process expertise, global delivery, industry leading software capabilities, and research innovations in areas like security and analytics-based optimization. In this role, his organization works closely with clients to apply the transformative power of cloud to reinvent the way they do business.",,,,
y,,,,m,Lars,Leckie,Partner,Hummer Winblad Venture Partners,"Partner, Hummer Winblad Venture Partners",,,speaker,,"Lars is a Partner at Hummer Winblad and has played a key role in the firm’s investments in Aria Systems (SaaS billing and customer management), vKernel (Virtualization Infrastructure), Karmasphere (Big Data Analtyics) and NimbusDB (Scalable SQL database). Prior to joining Hummer Winblad Venture Partners in 2006, Lars was involved in founding and operational roles at start-up companies. He was a co-founder of AutoFarm (now Novariant), a company focused on GPS and robotics. Lars has a Masters of Science (Engineering) from Stanford University and an M.B.A. from the Stanford Graduate School of business. He also holds an Engineering Physics degree from Queen’s University (with Honors). Lars currently sits on the board of Pancetera Software and Strobe.",,@larsleckie,http://www.facebook.com/larsleckie,http://www.linkedin.com/in/larsleckie
y,y,y,y,m,John	,Lee,"Director, Entrepreneur Services Group",Silicon Valley Bank,"Director, Entrepreneur Services Group, Silicon Valley Bank",,,speaker,y,"John Lee is a director in SVB's Entrepreneur Services Group. Lee establishes banking relationships with early stage technology companies. Lee also assists early and mid-stage technology companies with raising capital through review and feedback on investment materials and targeted introductions to venture capital firms and other investors. In addition, Lee provides relevant market insights and connections to strategic partners. Lee focuses on the enterprise and infrastructure software and hardware sectors, including cloud computing and SaaS, data management and storage, security, semiconductors, mobile and consumer electronic devices, data centers and broadband networks. Lee holds a bachelor's degree in economics from Stanford University and is a Chartered Financial Analyst.",,,,http://www.linkedin.com/in/johncjlee
y,y,y,y,m,Ping,Li,Partner,Accel Partners,"Partner, Accel Partners",8,,speaker,y,"Ping has been a partner since 2004. He focuses primarily on software and digital media investments. He currently is a Board Member of BitTorrent, Cloudera, Lookout, Mu Dynamics, Nimbula, Raptr, ScaleXtreme, and YuMe. Ping was also responsible for several Accel investments which have had successful exits including Ludic Labs (Groupon), Mochi Media (Shanda) and Reactivity (Cisco). Prior to Accel, Ping worked at Juniper Networks as a Senior Product Line Manager and Director of Corporate Development. He also worked at Goldman Sachs and McKinsey & Company, advising technology clients in their growth strategies.",,@ping_accel,http://www.facebook.com/Accel,
y,y,y,y,f,Teresa,Lunt,VP and Director of the Computing Science Laboratory,"PARC, a Xerox company","VP and Director of the Computing Science Laboratory, PARC, a Xerox company",8,,speaker,y,"Teresa Lunt is Vice President and Director of Computing Science Laboratory at PARC, a Xerox company. She directs a wide range of research, including content-centric networking; ubiquitous computing; embedded sensor networks and ad hoc networking; security and privacy; and ethnography. Under Lunt, the laboratory has engaged in multiple strategic research and co-development relationships. Lunt is a Principal Scientist at PARC. Before PARC, she was Assistant Director and Program Manager in DARPA's Information Technology Office, where she launched programs to fund computer and network security research. Lunt previously led teams to develop the first intrusion detection system and secure database system at SRI International. Lunt received an M.A. in Applied Mathematics from Indiana University and an A.B. in Geophysics from Princeton.",,@parcinc,,
y,y,y,y,m,Avery,Lyford,Chairman Elect,Churchill Club,"Chairman Elect, Churchill Club",,,speaker,y,"Avery was the CEO of several venture backed software companies in open source, virtualization, and cloud computing (Linuxcare & Digisense).  Currently he is working with Dave Thomson (author of ""Blueprint to a Billion"") to consult and invest in high growth companies.  He was Chairman of a social networking company (Angstro) acquired by Google and VP of Business Development for a cloud platform-as-a-service company (Makara) acquired by Red Hat.  He is Chairman-elect of the Churchill Club. He was the first business builder hired into McKinsey's business building practice.  At IBM he was on the founding team of IBM x86 server business and was responsible for product management from inception to over $1B in revenue.",,@averylyford,,http://www.linkedin.com/profile/view?id=217112&trk=tab_pro
y,y,y,y,m,Dante ,Malagrino,CEO,Embrane,"CEO, Embrane",,,speaker,y,"Born and raised in Italy, Dante is the co-founder and CEO of Embrane, where he leads and inspires the team to turn the company’s vision into execution, drives the values and the culture that define the company, and sometimes stocks the break-room.  His professional life before that is pretty simple: a little over 10 years at Cisco.  He was part of one of the most successful teams at Cisco, building the Catalyst 6500 family of switches. He later became part of the founding team of Andiamo, a spin-off that Cisco created to enter and disrupt the storage networking market.  More recently, he led the worldwide marketing campaign for Cisco’s Data Center 3.0 strategy.  While at Cisco he wore several hats: engineer, product manager, marketing manager and sales manager.  He even spent three years in Europe, evangelizing Cisco’s Data Center story to the market.  When he is not thinking about how to power the agile network, Dante enjoys traveling, scuba diving, and cooking homemade pizza from scratch.",,@dantemalagrino,http://www.facebook.com/embrane,http://www.linkedin.com/in/dantemalagrino
y,y,y,y,m,Om,Malik,Founder,GigaOM,"Founder, GigaOM",,,speaker,y,"Om Malik has more than 15 years of experience as a journalist covering technology and business news. He was part of the founding team of Forbes.com as a Senior Editor. He then went on to become a senior writer at Red Herring during its glory days before joining Business 2.0 in March 2003, covering telecom, innovation and broadband stories. His contributions have been published in The Wall Street Journal, The Economist and MIT Technology Review. Additionally, Om is the author of “Broadbandits: Inside the $750 Billion Telecom Heist.” He is also the recipient of many industry awards, including Excellence in Journalism from the Society of Professional Journalists in 2001 and the Gold Award from American Society of Business Publication Editors in 2001.",,,,
y,y,y,y,m,Paul ,Maritz,CEO,VMware,"CEO, VMware",1,,speaker,y,"Paul Maritz joined VMware in 2008 as President and CEO. He was previously President of Cloud Infrastructure and Services at EMC after the company's acquisition of Pi, where he was founder and CEO. Before that, he spent 14 years at Microsoft. He was a member of the five-person Executive Committee that managed the overall company and he oversaw the development and marketing of Windows 95, Windows NT, and Windows 2000, Visual Studio and SQL Server, and the complete Office and Exchange Product Lines. He also spent five years at Intel. Born and raised in Rhodesia (now Zimbabwe), Paul is a graduate in Mathematics and Computer Science of the Universities of Cape Town and Natal in South Africa. He is Chairman of the Grameen Foundation. ",,,,
y,y,y,y,m,Gavin,Michael,"Global Managing Director, R&D and Alliances",Accenture,"Global Managing Director, R&D and Alliances, Accenture",,,speaker,y,"Gavin joined Accenture in April 2010 to lead Accenture’s efforts around innovation, technology alliances and the Accenture Technology Labs. He has more than 20 years of experience in technology leadership in the Financial Services Industry, with significant experience in driving major business change. Most recently, Gavin was the Retail Technology Director, Lloyds Banking Group and was a member of the Retail Bank Board. Prior to this role, he served as CIO of Lloyds TSB – UK Retail Banking & General Insurance. In this capacity, Gavin set the information technology strategy and direction for growing the UK Retail Banking Division and drove strong collaboration and alignment of technology with the business. ",,@gavinmichael,,
y,y,y,y,m,Marten ,Mickos,CEO,Eucalyptus Systems,"CEO, Eucalyptus Systems",7,,speaker,y,"Marten Mickos builds global disruptive businesses. As CEO of MySQL AB for seven years, Mickos grew that company from a garage start-up to the second largest open source company in the world. After the acquisition by Sun Microsystems of MySQL AB for $1bn, he served as Senior Vice President of Sun's Database Group. Previously, Mickos held multi-national CEO and senior executive positions in his native Finland. He is a member of the board of Mozilla Messaging and Electrosonic. Mickos holds a M.Sc. in technical physics from Helsinki University of Technology. In 2006 he received the Audemars Piguet ""Changing Times Award: European Entrepreneur of the Year 2006"" and the Nokia Foundation Award.",,@martenmickos,,http://www.linkedin.com/pub/marten-mickos/0/1b/7b5
y,y,y,y,m,Paul ,Miller,"Founder, Cloud of Data","Cloud Curator, GigaOM Pro","Founder, Cloud of Data and Cloud Curator, GigaOM Pro ",,,speaker,y,"Paul is a consultant working with clients around the world that wish to understand the opportunities offered by Cloud Computing, Big Data, or the Semantic Web. In addition, Paul curates the Infrastructure/Cloud Computing channel for GigaOM Pro - http://pro.gigaom.com/topic/infrastructure. ",,http://twitter.com/paulmiller,http://www.facebook.com/profile.php?id=610521030,http://www.linkedin.com/in/pau1mi11er
y,y,y,y,m,Mike,Miller,Founder and Chief Scientist,Cloudant,"Founder and Chief Scientist, Cloudant",,,speaker,y,"Mike enjoys putting algorithms in the wild, solving problems for the first time, and building things. He honed his computing repertoire while studying the universe’s fundamental particles and interactions as a physicist, most recently at the Large Hadron Collider where he cut his teeth on petabyte-per-second problems. At Cloudant he enjoys seeing his ideas transformed into superior code by an outstanding team. Outside of work he enjoys globetrotting and all things outdoors.",,@mlmilleratmit ,,http://www.linkedin.com/pub/mike-miller/6/90a/a68
y,y,y,y,m,Claus ,Moldt ,Global CIO and SVP Service Delivery,salesforce.com,"Global CIO and SVP Service Delivery, salesforce.com",,,speaker,y,"Claus Moldt is the Global CIO and Senior Vice President of Service Delivery at salesforce.com. His teams are responsible for the day-to-day operations of the internal and external infrastructure which includes Capacity Planning, Availability Architecture, Disaster Recovery, Datacenters, Network, Servers and Storage Infrastructure. Claus has more than 24 years of operational, support and consulting experience supporting and architecting large scale, highly available infrastructures. Prior to joining salesforce.com in 2006, he spent four years at eBay where his responsibilities included the delivery, availability and maintenance of the eBay infrastructure. Claus has also held positions at Loudcloud and Oracle where he worked with Fortune 500 customers to aid in setting up scalable infrastructures.",,,,
y,y,y,y,m,Lew ,Moorman ,"Chief Strategy Officer and President of the Rackspace Cloud
",Rackspace,"Chief Strategy Officer and President of the Rackspace Cloud, Rackspace",6,,speaker,yes,"Lew Moorman is instrumental in driving strategic planning, product development and new business initiatives for Rackspace. He joined the company in April of 2000 and has served a variety of strategy and marketing roles throughout the company's growth. Before joining Rackspace, Moorman held several positions at the management consulting firm McKinsey & Company, advising high technology clients on critical strategic issues. As Rackspace Hosting's Chief Strategy Officer, Lew Moorman drives strategic planning, product development and new business initiatives across the company. He also serves as President of Rackspace's Cloud business, leading the company's fastest growing business unit. He speaks frequently at industry events on cloud computing, hosting and the rapidly evolving world of IT.",,@lewmoorman,,
y,y,y,y,m,Satya ,Nadella,"President, Server and Tools Business",Microsoft,"President, Server and Tools Business, Microsoft",5,,speaker,y,"As president of the Servers and Tools Business (STB) at Microsoft, Satya Nadella is accountable for the overall business and technical vision, strategy, operations, engineering and marketing for Microsoft's $15 billion business.  Nadella and his team provide Microsoft’s enterprise and cloud computing technology roadmap, guidance, and solutions for the company’s largest customers and industry partners worldwide.  Prior to his role in STB, Nadella was senior vice president of R&D for the Online Services Division where he was responsible for the technical vision and engineering of some of the largest web services and cloud infrastructure in the world.  Nadella joined Microsoft in 1992.  A native of Hyderabad (India), he has a bachelor's degree in Electrical Engineering from Mangalore University, a master's degree in computer science from the University of Wisconsin and an MBA from the University of Chicago.",,,,
y,y,y,y,m,Don ,Newell,"VP and CTO, Server",AMD,"VP and CTO, Server, AMD",,,speaker,y,"Newell is responsible for the concept and definition of AMD’s long-term server roadmap based on current conditions, expected demand and long-term server trends. He leads multiple worldwide teams and works alongside other AMD design and development teams to ensure successful transition of programs from design to market availability. A distinguished engineer with more than 20 patents filed, Newell previously served as a senior principal engineer leading the System-on-Chip (SoC) and datacenter networking architecture groups within Intel Labs. During his 16 years with Intel, Newell guided development of both SoC and server platform architecture innovations. Newell has been published in more than 60 peer-reviewed research journals and publications. Newell received a Bachelor of Science from the University of Oregon.",,,,www.linkedin.com/in/donaldnewell
y,y,y,y,m,Forrest,Norrod,VP and GM of Server Platforms,Dell,"VP and GM, Server Platforms, Dell",9,,speaker,y,"Forrest Norrod serves as Vice President and General Manager of Dell’s Server Platform Group. His team is responsible for Dell’s server products, including the award-winning PowerEdge servers. Prior to his current role, Mr. Norrod, 44, served as Vice President and General Manager of Data Center Solutions (DCS) at Dell, Inc. DCS customers are on the leading edge of IT innovation and have the greatest density, performance, and energy challenges in their data centers. Before founding DCS in 2007, Mr. Norrod served in a variety of leadership roles as Dell, including Vice President of Engineering for all Dell products and as Dell’s Chief Technology Officer. Mr. Norrod received a Master's and bachelor's degrees in electrical engineering from Virginia Tech. ",,,,
y,y,y,y,m,Dheeraj,Pandey,CEO ,Nutanix,"CEO, Nutanix",,,speaker,y,"Dheeraj is Co-Founder and CEO of Nutanix. Dheeraj brings over 12 years of experience working at high growth enterprise technology companies. Prior to founding Nutanix, Dheeraj was VP Engineering at Aster Data where he built the engineering team from ground up, overseeing the development of multiple releases of the product. Prior to Aster, Dheeraj was at Oracle where he managed development of storage engine for Oracle Database and Oracle Exadata. Dheeraj holds a Masters in Computer Science from University of Texas at Austin, where he was a Graduate Fellow, and a Bachelor of Science in Computer Science from the Indian Institute of Technology (IIT), Kanpur, where he was adjudged the “Best All Rounder Among All Graduating Students in All Disciplines”.",,@trailsfootmarks,www.facebook.com/pandey.dheeraj,http://www.linkedin.com/in/dpandey
y,y,y,y,m,Geva,Perry,"Cloud Strategy and Marketing Advisor, Blogger",Thinking Out Cloud,"Cloud Strategy and Marketing Advisor, Blogger, Thinking Out Cloud",,,speaker,y,"Geva Perry has 15 years of experience as an executive in the technology industry. His blog on cloud computing and SaaS, Thinking Out Cloud, is widely read and he is a frequent speaker on the topic at corporations and industry events. He has been an advisor to a number of companies, small and large, on strategy and marketing, including startups Heroku, New Relic, Twilio, Sauce Labs, Xeround, Cloudsoft and others, as well as large publicly-traded telcos and hosting providers, such Deutsche Telekom and NEC. Geva has been named one of the Top 50 Bloggers on Cloud Computing by the Cloud Computing Journal. Previously, he was CMO at GigaSpaces Technologies and held executive roles in other startups.",,@gevaperry,,http://www.linkedin.com/in/gevaperry
y,y,y,y,m,Chris ,Pinkham,Co-Founder and CEO,Nimbula,"Co-Founder and CEO, Nimbula",,,speaker,yes,"Chris is a senior technology executive and entrepreneur with over 20 years of experience building Internet and large infrastructure environments. Chris started his career co-founding South Africa's first ISP, TICSA/Internet Africa, which was sold to UUNET in 1996. Most recently Chris initiated and managed the development of Amazon’s Elastic Compute Cloud (EC2), which has emerged as the undisputed leading public Cloud Infrastructure. Prior to that, Chris was Vice President of Engineering at Amazon.com, responsible for global IT infrastructure. Chris is a graduate of the University of Cape Town.",,,,
,y,y,y,f,Michelle,Quinn,Silicon Valley Correspondent,POLITICO Pro,"Silicon Valley Correspondent, POLITICO Pro",,,speaker,y,"Michelle Quinn is a Silicon Valley-based technology correspondent for POLITICO Pro covering the intersection of tech, policy and politics with a national focus. Her most recent stories have been about Joe Lockhart joining Facebook, Aneesh Chopra, the White House chief technology officer and the gmail hack. She has covered Apple, Hewlett-Packard and digital entertainment for the Los Angeles Times, the San Jose Mercury News and the San Francisco Chronicle.",,,,
y,y,y,y,m,Sam ,Ramji,"VP, Strategy",Apigee,"VP, Strategy, Apigee",,,speaker,yes,"Sam is Vice President of Strategy at Apigee, the leading API products and services company. He brings over 15 years of industry experience in enterprise software, product development, and open source strategy. Prior to Apigee, Ramji led open source strategy across Microsoft. He was a founding member of the AquaLogic product team and has built large-scale enterprise and Web-scale applications, leading the Ofoto engineering team through its acquisition by Kodak. Other experience includes hands-on development of client, client-server and distributed applications on Unix, Windows and Macintosh at companies ranging from Broderbund to Fair Isaac. ",,@sramji,,http://www.linkedin.com/in/sramji
y,y,y,y,m,Partha,Ranganathan,Distinguished Technologist,HP,Distinguished Technologist,6,,speaker,y,"Partha Ranganathan is currently a distinguished technologist at Hewlett-Packard Labs. His research interests are in systems architecture and management, power management and energy-efficiency, and systems modeling and evaluation. He is currently the principal investigator for the exascale datacenter project at HP Labs that seeks to design next-generation servers and datacenters and their management. Partha received his B.Tech degree from the Indian Institute of Technology, Madras and his M.S. and Ph.D. from Rice University, Houston.",,@HPLabs,,
y,y,y,y,m,Jesse ,Robbins,Co-Founder and CEO,Opscode,"Co-Founder and CEO, Opscode",,,speaker,y,"Jesse Robbins is Cofounder & CEO of Opscode, the leader in Cloud Infrastructure Automation. Jesse is a widely recognized expert in Infrastructure, Web Operations, and Emergency Management. Jesse serves as co-chair of the Velocity Web Performance & Operations Conference, was the editor of the Web Operations book, and is a contributor to the O’Reilly Radar blog. Prior to founding Opscode, he worked at Amazon.com with the title of “Master of Disaster” where he was responsible for Website Availability for every property bearing the Amazon brand. Jesse was previously a volunteer Firefighter/EMT and Emergency Manager, and led a task force deployed in Operation Hurricane Katrina.",,@jesserobbins,,http://www.linkedin.com/in/jesserobbins
y,y,y,y,m,Luis ,Robles,Partner,Sequoia Capital,"Partner, Sequoia Capital",7,,speaker,y," Prior to joining Sequoia Capital in 2010, Luis was a Senior Product Manager at VMware where he helped build out various product and operations initiatives. Previously, he was involved with other Silicon Valley start-ups. Luis has BS and MS degrees in Computer Science from Stanford University, and an MBA from Harvard Business School.",,,,http://www.linkedin.com/in/lrobles
