IMPORTANT: Structure 2011 Speaker Information Request,Publish,Photo Ready?,List on front page?,Gender,First Name,Last Name,Title,Company,Tagline,Order (front page),Order (speaker page),Type (default: speaker),Bio Ready?,Biography,timestamp,P Twitter,P Facebook,P LinkedIn
y,y,y,y,m,Anant,Agarwal,Co-Founder and CTO,Tilera,"Co-Founder and CTO, Tilera",,,speaker,y,"Anant Agarwal is a cofounder and CTO of Tilera Corporation, a professor of Electrical Engineering & Computer Science at MIT, and a member of the CSAIL Laboratory. His research group at CSAIL is developing an operating system called fos for cloud and multicore. He led the development of many technologies including Raw – an early tiled multicore processor, Sparcle – an early multithreaded microprocessor, and Alewife – a scalable multiprocessor. Agarwal won the Maurice Wilkes prize for computer architecture, and MIT’s Smullin and Jamieson prizes for teaching. He holds a Guinness Record for the largest microphone array and author of “Foundations of Analog and Digital Electronic Circuits.” Agarwal holds a Ph.D. from Stanford and a bachelor's from IIT Madras.",,,,http://www.linkedin.com/profile/view?id=46628580
y,y,y,y,f,Vanessa,Alvarez,Analyst,Forrester Research,"Analyst, Forrester Research",,,speaker,y,"Vanessa serves Infrastructure & Operations Professionals. She focuses on primary storage architectures & strategy, the evolution of these related to converged infrastructure & cloud computing scenarios and works with enterprises to navigate the complexity and enable strategic storage environments. Previously,Vanessa was an analyst with Frost & Sullivan, covering enterprise infrastructure. She helped clients understand how emerging technologies, operational.business models affect their IT environment, business processes, and organizational structure. Prior to this, Vanessa was an analyst with Yankee Group, where she provided insight on technology trends to key enterprise vendors and delivered recommendations. Vanessa is well respected in media and has appeared on Bloomberg TV. She is regularly quoted in the Wall Street Journal, Reuters, Bloomberg, Forbes and CNNMoney.",,@VanessaAlvarez1,,http://www.linkedin.com/pub/vanessa-alvarez/0/277/2b5
y,y,y,y,m,Sid,Anand,Software Architect,Netflix ,"Software Architect, Netflix",,,speaker,y,"Sid Anand is a technologist/software architect with deep experience designing and scaling high-traffic web sites. In 2007, he joined Netflix to help scale its core architecture. With Netflix's move to the cloud, he helped create Cloud-based systems to improve Netflix’s scalability, performance, and availability. As part of this effort, he helped to define Netflix's transition to cloud-based NoSQL storage from traditional relational databases. Prior to joining Netflix, he served as the VP of Engineering at Etsy, worked as a search engineer and researcher at eBay, and solved performance issues at Siebel Systems. He earned his B.S. and M.Eng degrees from Cornell University – his graduate work focused on distributed systems.",,@r39132 ,,http://www.linkedin.com/in/siddharthanand
y,y,y,y,m,Guido,Appenzeller,Co-Founder and CEO ,Big Switch Networks,"Co-Founder and CEO, Big Switch Networks",,,speaker,y,"Guido Appenzeller is the Co-Founder and CEO of Big Switch Networks. Before co-founding Big Switch Networks, he was a Consulting Professor at Stanford University and Head of the Clean Slate Lab where he managed the OpenFlow standards effort and led the team that developed the OpenFlow reference implementation. He was named a Technology Pioneer by the World Economic Forum and holds a PhD in Computer Science from Stanford University and a M.S. (Diplom) in Physics from Karlsruhe Institute of Technology.",,@openflownews,,http://www.linkedin.com/in/appenz
y,y,y,y,m,Shekar,Ayyar,"VP, Strategy and Corporate Development",VMware,"VP, Strategy and Corporate Development, VMware",,,speaker,y,"Shekar Ayyar is the VP of Strategy and Corporate Development at VMware, managing the company’s M&A and aligning strategy across businesses. Shekar has more than 10 years of senior management experience in the software industry. Previously, Shekar was SVP of Product Management at BindView, a public security software company that was acquired by Symantec. Prior to that, Shekar held senior roles at Instantis and Lucent technologies, spanning business development and products and was a consultant at McKinsey before that. Shekar received his Ph.D. in Electrical Engineering from Johns Hopkins, and his MBA from the Wharton school graduating as a Palmer Scholar. He is also an alumnus of the IIT, Mumbai (BSEE). ",,,,
y,y,y,y,m,Jonathan,Becher,Interim CMO,SAP,"Interim CMO, SAP",,,speaker,y,"As the interim Chief Marketing Officer of SAP, Jonathan Becher is responsible for the development, oversight, and execution of marketing strategy across the global organization. Jonathan reports to Bill McDermott, Co-CEO of SAP AG, and serves on his management team. Becher is a frequent speaker at industry events, an active member of the enterprise applications community, and author of multiple papers on a wide range of subjects, including a popular blog. Becher joined SAP from its 2007 acquisition of Pilot Software, where he was president and chief executive officer. Prior to leading Pilot Software, Becher was CEO and president of Accrue Software, and president, CEO and co-founder of NeoVista Software.",,@jbecher,,www.linkedin.com/in/jbecher
y,y,y,y,m,Val,Bercovici ,"Sr. Director, Office of the CTO",NetApp,"Sr. Director, Office of the CTO, NetApp",8,,speaker,y,"Val joined NetApp in 1998 and leads the Strategic Planning Team within the office of the CTO, focused on next-generation research projects responsible for NetApp’s product vision. Val introduced the first Cloud Standard to the industry as chairman of SNIA’s Cloud Storage Initiative, whose mission is to foster the growth and success of the cloud storage market. Previously, Val served as the vice-chair of SNIA’s Solid-State Storage Initiative. Val has over 25 years of IT industry experience spanning NCR (AT&T) and Cognos (IBM), with 12 years in storage at EMC and NetApp. Previously, he worked as a consultant to private industry and government. Val holds a bachelor of science degree in Computer Science from the University of Ottawa.",,@valb00,,http://ca.linkedin.com/in/valb00
y,y,y,y,m,Randy,Bias,Co-Founder and CTO,Cloudscaling ,"Co-Founder and CTO, Cloudscaling",,,speaker,y,"Randy's provocative views on the profound disruption caused by cloud computing have made him among the most influential voices in the industry. He uses this influence to advocate an open debate about which technologies will win in driving cloud to large-scale adoption. He has inspired organizations to embrace the disruption of cloud to succeed in a world where computing resources are ubiquitous, inexpensive, instantly scalable, and highly available. Randy was the technical visionary at GoGrid and built the world’s first multi-cloud, multi-platform cloud management framework at CloudScale Networks. He led the open-licensing of GoGrid's API, which inspired Sun, Rackspace, VMware and others to open-license theirs. Randy is among the most influential speakers and bloggers on the topic of cloud computing.",,@randybias,,http://www.linkedin.com/in/randybias
y,y,y,y,m,Dries,Buytaert ,Co-Founder and CTO,Acquia,"Co-Founder and CTO, Acquia",,,speaker,y,"Dries Buytaert is the original creator and project lead for the Drupal open source web publishing and collaboration platform. Buytaert serves as president of the Drupal Association, a non-profit organization formed to help Drupal flourish. He is also co-founder and chief technology officer of Acquia, a venture-backed software company that offers products and services for Drupal. Dries is also a co-founder of Mollom, a web service that helps you identify content quality and, more importantly, helps you stop website spam. A native of Belgium, Buytaert holds a PhD in computer science and engineering from Ghent University and a Licentiate Computer Science (MsC) from the University of Antwerp. ",,,,
y,y,y,y,m,Martin,Casado,CTO,Nicira Networks,"CTO, Nicira Networks",,,speaker,y,"Hi, I’m Martìn Casado and I'm not afraid to write my bio in the first person. I’m the founder and CTO of Nicira Networks, a startup in the network virtualization space. I also masquerade as a consulting professor at Stanford where I hang around the Clean Slate program. I received my PhD from Stanford during which my research lead to the creation of the SDN/OpenFlow effort. I’ve been very involved with its development and evangelism since. I think the next stage in human evolution is to build next generation networks. To that end, I believe networks should be programmable, I have a project-crush on Open vSwitch, and I think network virtualization is going to change the world.",,,,
y,y,y,y,m,Wenceslao ,Casares,CEO,Bling Nation,"CEO, Bling Nation",,,speaker,y,"Wenceslao Casares is an entrepreneur specializing in technology and finance. He founded Patagon. He also founded Wanako Games ( www.wanakogames.com), and Internet Argentina (www.interar.com.ar). Wenceslao was selected ""Global Leader of Tomorrow"" by the World Economic Forum in Davos ( www.weforum.org) and as Endeavor Entrepreneur by Endeavor (www.endeavor.org), an organization of which he later became a board member. As part of his nonbusiness activities, he founded the Fundación Síntesis ( www.fundacionsintesis.cl). Wenceslao studied business administration for three years at the Universidad de San Andrés, in Buenos Aires, and completed the Owner/President Management program at Harvard University.",,@blingnation,http://facebook.com/blingnation,http://www.linkedin.com/companies/bling-nation
y,y,y,y,m,Navin,Chaddha,Managing Director,Mayfield Fund,"Managing Director, Mayfield Fund",,,speaker,y,"Navin Chaddha is a proven serial entrepreneur and venture investor. He invests in the Enterprise, Telecom, Energytech, Internet and Semiconductor sectors in the U.S. and is the founder of Mayfield’s India Fund. He currently serves on the Board of Directors of Gigya, Pano Logic, SolarCity, StorSimple, Tejas Networks and Wide Orbit and is also involved with Mayfield investments in Consim, Lattice Power, Pulse, SeedFund, ShineOn and SMiT. Navin has made over 30 investments of which 11 have had IPOs and another 9 have been acquired. Some of his notable investments include Akamai, Qwest Communications, MakeMyTrip, and Rhythms Net Connections which had successful IPOs on NASDAQ, and IL&FS Investsmart, Persistent Systems, Provogue and Suzlon which had IPOs on Indian Stock Exchanges.",1268434461,,,
y,y,y,y,m,Derek,Collison,"CTO, Chief Architect, Cloud Division",VMware,"CTO, Chief Architect, Cloud Division, VMware",,,speaker,y,"Derek Collison is an industry veteran with over 20 years of experience, specializing in high performance distributed systems. With tenures at Google and TIBCO Software, he specializes in Distributed Systems Architecture, High Performance Messaging Systems, and Event-Driven Systems. His current focus is Cloud Foundry and the OpenPaaS at VMware Inc.",,@derekcollison,,http://www.linkedin.com/in/derekcollison
y,y,y,y,m,Michael ,Crandell,CEO,RightScale,"CEO, RightScale",8,,speaker,y,"Michael Crandell is the CEO and a founder of RightScale, where he provides the vision and direction for the company as it pioneers innovative ways to bring the power of cloud computing to any organization. Crandell is a frequent speaker at cloud computing industry conferences, and he has played a major role in helping establish and promote openness and transparency in the cloud market. Prior to RightScale, he served as CEO at several Internet Software-as-a-Service (SAAS) companies and as executive vice president at eFax.com. Crandell received his B.A. from Stanford University and completed graduate studies at Harvard University. ",,@michaelcrandell,,http://www.linkedin.com/in/michaelcrandell
y,y,y,y,m,Simon,Crosby,"CTO, Datacenter and Cloud Division",Citrix Systems,"CTO, Datacenter and Cloud Division, Citrix Systems",,,speaker,y,"Simon Crosby is the Chief Technology Officer of the Datacenter and Cloud Division at Citrix Systems. He was a founder and CTO of XenSource prior to the acquisition of XenSource by Citrix. Prior to XenSource, Simon was a principal engineer at Intel where he led strategic research in distributed autonomic computing, platform security and trust. Previously, he was the founder of CPlane Inc., a network optimization software vendor, where he held a variety of executive roles. Before joining the private sector, Simon was a tenured faculty member at the University of Cambridge, UK, where he led research on network performance and control, and multimedia operating systems. He is author of over 35 research papers and patents on a number of datacenter and networking topics including security, network and server virtualization, resource optimization and performance. In 2007, Simon was awarded a coveted spot as one of InfoWorld’s Top 25 CTOs.",,,,
y,y,y,y,f,Debra,Danielson,"SVP, Merger and Acquisition Strategy and Distinguished Engineer",CA Technologies,"SVP, Merger and Acquisition Strategy and Distinguished Engineer, CA Technologies",9,,speaker,y,"Debra Danielson is a Distinguished Engineer and is Senior Vice President, Merger and Acquisition Strategy at CA Technologies where she is responsible for identification of opportunities within fast moving and important new and existing markets, technologies and trends to achieve key strategic goals. Debra has held technical, strategic, operational and managerial roles over her 25+ year career, most recently as Senior Vice President, Center of Excellence, where she was responsible for common engineering services and site & skill strategy in support of the Development and Technology Group. Debra is one of only 25 Distinguished Engineers at CA Technologies and the first woman to achieve this honor.",,,,
y,y,y,y,m,Lorenzo ,De La Vega,"VP, Business Development, Application and Integration Middleware, Software Group ",IBM,"VP, Business Development, Application and Integration Middleware, Software Group, IBM",,,speaker,y,"Lorenzo is the Vice President, Business Development, Application and Integration Middleware, IBM Software Group where he is responsible for the strategic planning and execution of non-organic business activities including acquisitions, divestitures, software royalty agreements and business partner strategic relationships for IBM’s WebSphere brand. Lorenzo has served in executive roles in the Services, Systems and Software Groups of IBM, concentrating on mergers & acquisitions since 1992. Prior to joining IBM, Lorenzo held financial management positions at Storage Technology Corporation in Louisville, Colorado. Lorenzo received an MBA from the University of Colorado and a bachelor’s degree in Finance from Colorado State University.",,,,
,y,y,y,m,Satish ,Dharmaraj,Partner,Redpoint Ventures,"Partner, Redpoint Ventures",,,speaker,y,"Satish Dharmaraj is a Partner with Redpoint Ventures. Prior to Redpoint, Satish was the founder/CEO of Zimbra. At Zimbra, he grew sales from inception to $20M in subscription sales in the first year of selling and nearly doubled sales the next year. By the time it was sold, Zimbra was featured in the WSJ (Front Page), the NY Times, Forbes, Fortune and USA today. Prior to founding Zimbra, Satish was VP of the Messaging Products Division at Openwave Systems, responsible for the email, unified messaging, voicemail, and instant messaging product lines selling to large carriers and ISPs. Satish was at Sun Microsystems’ JavaSoft Division from 1995 through 1998 where he was responsible for the conception, design and implementation of Java Server Pages (JSPs). Satish has B.S. and M.S. degrees in Computer Sciences and an executive management degree from the Harvard Business School. Satish focuses on investments in the mobile, consumer and cloud computing areas. ",,,,
y,y,y,y,m,John	,Dillon,CEO,Engine Yard,"CEO, Engine Yard",8,,speaker,y,"John Dillon has thirty years of experience building successful technology companies. He began his career as a Systems Engineer for EDS (Electronic Data Systems) and then held a variety of sales management positions for high tech companies including Oracle Corporation. During the past 15 years, John has served as President and Chief Executive Officer for Hyperion Solutions (at the time, a public software company with $500 million in revenue) and then as CEO for Salesforce.com. Beginning in 2002, John served as CEO for Navis, LLC, a private company, specializing in software systems for operating large marine container terminals and distribution centers. In 2007, he sold Navis to Zebra Technology and in 2008 completed its transition to a subsidiary within Zebra. ",,,,
y,y,y,y,m,Barry,Evans,CEO,Calxeda,"CEO, Calxeda",,,speaker,y,"Barry Evans founded Calxeda in 2008 as its CEO, raised $48M in investments, and has already earned mention as one of the world’s most innovative companies by MIT. Mr. Evans is an 20 year veteran of the semiconductor industry. Prior to founding Calxeda, he was the VP and GM of Marvell’s Application Processing Business Unit, responsible for the Xscale processor (ARM-based) SoC product line, the world’s highest performance handheld processors with revenues exceeding $300 million. Prior to this, Mr. Evans served in GM and Director roles at Intel responsible for customer engagements and product strategies to address the wireless handheld and infrastructure markets. He holds a BSEE from the University of Texas at Austin and an MBA from Boston University.",,,,http://www.linkedin.com/in/barryevans
y,y,y,y,m,Andrew,Feldman,CEO,SeaMicro,"CEO, SeaMicro",,,speaker,y,"Prior to Co-founding SeaMicro, Andrew was an Entrepreneur in Residence at Crosslink Capital and US Venture Partners. Before that, he was VP of Marketing and Product Management at Force10 Networks, where he was responsible for marketing, product management, and business development. Prior to Force10, Andrew was VP of Corporate Marketing and Corporate Development for Riverstone Networks (Acquired by Alcatel) from inception through IPO. Prior to Riverstone, Andrew served as Senior Director for Worldwide Product Marketing and Product Management at Cabletron Systems. Andrew joined Cabletron through its acquisition of YAGO Systems where he wrote the business plan and then as Senior Director of Marketing and Business Development, led marketing and strategic alliances. Andrew holds an M.B.A. and B.A. from Stanford University.",,,,http://www.linkedin.com/in/andrewdfeldman
y,y,y,y,m,Frank,Frankovsky,"Director, Hardware Design and Supply Chain",Facebook,"Director, Hardware Design and Supply Chain, Facebook",,,speaker,y,"Frank is responsible for Technical Operations at Facebook as the Director of Hardware Design and Supply Chain. He is responsible for Hardware Engineering, Technical Program Management, Capacity Engineering & Analysis, Facebook Labs and Supply Chain Operations teams. Prior to joining Facebook, Frank spent 14 years with Dell where he was an integral part of building Dell’s PowerEdge server business. He also co-founded Dell’s Data Center Solutions business and also participated in product management, technical consulting and technical operations. He launched the industry’s first rack mounted x86 servers for Compaq prior to Dell. Frank holds a BA in Marketing from Stephen F. Austin State University in Nacogdoches, TX.",,,,
y,y,y,y,m,George,Gilbert,Principal,TechAlpha,"Principal, TechAlpha",,,speaker,y,"George is Principal and co-founder of TechAlpha, a consultancy focused on the evolution of traditional enterprise software to data-centric applications on hybrid clouds. TechAlpha includes financial, business model, and product strategy perspectives in its approach. Previously, George was lead equity research analyst for enterprise software at Credit Suisse. George started his career at Lotus Development (when it was still bigger than Microsoft!). There he was the second product manager on Lotus Notes.",x,@ggilbert41,http://www.facebook.com/George.J.Gilbert,http://www.linkedin.com/pub/george-gilbert/2/550/466
y,y,y,y,m,Michael ,Goguen,Partner,Sequoia Capital ,"Partner, Sequoia Capital ",,,speaker,y," Michael works with energy, internet and technology companies. Prior to joining Sequoia Capital in 1996, Michael spent 10 years in various engineering, research, and product management roles at DEC, SynOptics and Centillion, and was a director of Engineering at Bay Networks (NT). Michael was also a Technical Chairman of the ATM Forum. Michael has a BS in Electrical Engineering from Cornell University and an MS in Electrical Engineering from Stanford University.",,,,http://www.linkedin.com/pub/mike-goguen/0/14/233
y,y,y,y,m,Nolan,Goldberg,"Senior Counsel, IP and Technology",Proskauer LLP,"Senior Counsel, IP and Technology, Proskauer LLP",,,speaker,y,"Nolan M. Goldberg is Senior Counsel, Intellectual Property and Technology in Proskauer's Litigation & Dispute Resolution Department and a member of the Patent Law Group, resident in the New York office. As an intellectual property litigator, his practice focuses on patent and trade secret litigation and counseling. As a founding member of the Litigation Department's Electronic Discovery Task Force, Mr. Goldberg is often called upon to develop e-discovery strategies to be used in all types of litigations, with a particular focus on managing the overall burden and cost of the electronic discovery process and obtaining often overlooked electronic evidence, including computer forensics. Mr. Goldberg's complete professional bio can be found at http://www.proskauer.com/professionals/nolan-goldberg/",,,,http://www.linkedin.com/profile/view?id=2707463&trk=tab_pro
y,y,y,y,m,Bernard,Golden,CEO,HyperStratus,"CEO, HyperStratus",,,speaker,y,"Bernard Golden has been called a “cloud guru.” He is the CEO of HyperStratus, a Silicon Valley cloud computing consultancy which works with clients in the US and throughout the world. The firm's clients include Korea Telecom, Sensato Capital, and the Silicon Valley Education Foundation. HyperStratus provides cloud computing services in the areas of application security, system architecture and design, TCO analysis, and project implementation. Bernard is the Cloud Advisor for CIO Magazine. His blog has been called “brilliant and incisive” and is read by tens of thousands of people each month. His blog was named “Top 50 Cloud Computing Blog” by Sys-Con Media. Bernard's writings have also been published by the New York Times and the Harvard Business Review.",,@bernardgolden,,http://www.linkedin.com/profile/view?id=970946&locale=en_US&trk=tab_pro
y,y,y,y,m,Derrick,Harris,Structure Editor and Staff Writer,GigaOM,"Structure Editor and Staff Writer, GigaOM",,,speaker,y,"Derrick Harris has been covering the distributed computing space since 2003, when he began reporting on grid computing for a publication called GRIDtoday (later renamed On-Demand Enterprise). Derrick joined GigaOM as a contributing writer in 2009 and was one of the original curators for GigaOM Pro, where he continues to serve as a Senior Curator and analyst. Derrick holds a juris doctor degree, cum laude, from the William S. Boyd School of Law at the University of Nevada, Las Vegas.",,,,
y,y,y,y,m,Jonathan,Heiliger,"VP, Technical Operations",Facebook,"VP, Technical Operations, Facebook",4,,speaker,y,"Jonathan Heiliger is the Vice President of Technical Operations at Facebook, where he oversees global infrastructure and internal technology systems. Prior to Facebook, he was a technology advisor to several early-stage companies in connection with Index Ventures and Sequoia Capital. He formerly led the engineering team at Walmart.com, where he was responsible for infrastructure and building scalable systems. Jonathan also spent several years at Loudcloud (which became Opsware and was later acquired by HP) as the Chief Operating Officer. Earlier in his career, Jonathan was the CTO of Frontier GlobalCenter, and later founded Global Crossing's corporate venture capital group.",,,www.facebook.com/jh,www.linkedin.com/in/jheiliger
y,y,y,y,m,Phil,Hendrix,Founder and Director,immr,"Founder and Director, immr ",,,speaker,y,"Dr. Phil Hendrix is the director of immr (www.immr.org), a research and consulting firm he founded to help clients bring innovative new products and services to market.  Phil works with clients to uncover customer needs, optimize product/service features, achieve competitive differentiation and accelerate market acceptance.  He is also an analyst in GigaOm's analyst network, focusing on mobile and location-based services, in particular. Before founding immr, Phil was a partner with DiamondCluster and a principal with Mercer Management Consulting (now Oliver Wyman).  Previously, he was a professor at Emory University and the University of Michigan, where he taught courses in research, buyer behavior and marketing strategy.  Phil received his PhD in Marketing from the Graduate School of Business, University of Michigan.",1273609845,,,
y,y,y,y,f,Stacey,Higginbotham,Senior Writer,GigaOM,"Senior Writer, GigaOM",,,speaker,y,"Stacey Higginbotham is happy when immersed in SEC filings, tech specs or poking through a data center. She has spent the last ten years covering technology and finance for publications such as The Deal, the Austin Business Journal, The Bond Buyer and BusinessWeek, and works remotely from Austin, Texas.",,,,
