y,y,y,y,f,Liz,Shannon Miller,Co-Editor NewTeeVee ,GigaOM,"Co-Editor NewTeeVee, GigaOM",,,speaker,y,"As a co-editor of NewTeeVee, Liz Shannon Miller reviews the best and worst in web content, and has been called the Pauline Kael of online video by at least one person. She has been covering the online video space since 2006, is a member and co-founder of the International Academy for Web Television, and has curated the front page of YouTube with her web series picks. She is also a playwright and filmmaker in her very limited free time. Based in Los Angeles, she holds a degree in screenwriting and interactive multimedia from USC, and enjoys space battles, old school funk and videos of cats.",
y,y,y,y,m,Joshua,Siegel,"Product Lead, Live Streaming",YouTube,"Product Lead, Live Streaming, YouTube",,,speaker,y,"Joshua Siegel is YouTube's Lead Product Manager for Live Streaming and Video Creation.  In this role he drives the vision and roadmap for the YouTube Live platform, the cloud-based YouTube Video Editor, and for YouTube Upload – responsible for over 24 hours of video uploaded every minute.  Prior to YouTube, Joshua worked on Google's Mobile Search team, leading efforts to integrate user location and enhance the overall local search experience from mobile devices.  Before joining Google, Joshua worked in strategy and professional services for companies including Microsoft, VMware, and Oracle.  He holds a bachelor's degree in computer science from Brown University and an MBA in technology marketing from the Kellogg School of Management.",
y,y,y,y,m,Frank,Sinton,CEO and Co-Founder,MeFeedia,"CEO and CoFounder, MeFeedia",,,speaker,y,"Frank Sinton is the co-founder and CEO of Mefeedia, a multimedia search engine that aggregates 200, 000 video feeds in one place. MeFeedia also owns and operates The All Player, an advertising technology platform that makes it simple for video publishers and advertisers to monetize video across any format, player or device including HTML5. Frank has grown MeFeedia  5 million video consumers each month and developed direct distribution relationships with TV networks, studios and the web’s most popular publishers while The AllPlayer ad platform now serves more than fifty million video ads a month. Before founding MeFeedia.com, Sinton spearheaded the strategic technology vision at Sony Pictures Entertainment where he developed the search engine powering successful start up, Business.com. ",
y,y,y,y,m,Robin,Sloan,Media Partnerships,Twitter,"Media Partnerships, Twitter",,,speaker,y,"Robin Sloan works on media partnerships at Twitter, helping TV networks & websites use tweets in innovative, meaningful ways. Before that, he was a strategist at Current, an independent TV network co-founded by Al Gore and Joel Hyatt, and a reporter and producer at the Poynter Institute, a journalism school and think tank. Before Poynter, he graduated from Michigan State with a degree in economics. He's also a writer who works at the intersection of storytelling and technology. You can learn more about him at robinsloan.com, and follow along at @robinsloan.",
y,y,y,y,m,Buddy,Snow,"Senior Director, Solutions Marketing,Broadband Home Solutions",Motorola Mobility,"Senior Director, Solutions Marketing,Broadband Home Solutions, Motorola Mobility",,,speaker,y,"Snow’s experience includes over 20 years of engineering, marketing, and executive management for consumer, broadband, and digital video products. He has spent the last 12 years developing and selling products into the worldwide cable television and IPTV markets. His previous experience includes senior management positions with Terayon, Harmonic, DIVA Systems Corp., and General Instrument, responsible for a variety of product categories such as compression, video processing, VOD, SDV, back office software systems, and broadband modems and gateways including voice and home networking.  Prior to broadband, Snow spent eight years working for Apple Computer, Inc. Snow holds a BS degree from North Carolina State University in Computer Science with a minor in Mathematics, graduating Summa Cum Laude.   He also holds a patent in human interface design.
",
y,y,y,y,m,Nova,Spivack,Co-Founder and President,Live Matrix,"Co-Founder and President, Live Matrix",,,speaker,y,"Nova Spivack is co-founder and President of Live Matrix, the first guide to live and upcoming scheduled events on the Web. Nova is a top thought leader on the future of the Web and a leading pioneer in Semantic Web technology. He was most recently the founder and CEO of Radar Networks, the makers of Twine.com (a semantic search engine acquired by Evri, Inc. in 2010), and is a serial entrepreneur whose previous ventures have included one of the first Web companies, EarthWeb (IPO in 1998; now Dice.com), which Nova co-founded in 1994, SRI’s technology venture incubator nVention, and his own early stage startup factory, Lucid Ventures.",
y,y,y,y,m,Hardie,Tankersley,"VP, Innovation", Fox Broadcasting Company,"VP, Innovation,  Fox Broadcasting Company",10,,speaker,y,"Hardie develops online strategy and social media applications for FOX Broadcasting Company. He started creating online and interactive entertainment by building a local BBS on a 300 baud modem on an Apple II back in the 70s. In the intervening years he has managed the development of online entertainment products including internet access for Apple’s eWorld, the official backstage webcast of the Grammy Awards, the Moxi cable media center DVR, the online video portal for Real Networks, and Yahoo!’s TV and Movies properties. He thinks that conventional wisdom is almost always wrong.",
y,y,y,y,m,Hunter ,Walk,Director Product Management,YouTube,"Director Product Management, YouTube",3,,speaker,y,"Hunter leads consumer product management at YouTube, delivering 2+ billion playbacks a day to the world's largest video community.  Since joining Google in 2003, he has also lead the development of Google Video's Syndication & Distribution and managed product and sales efforts for AdSense, Google's contextual advertising business. Prior to this, as a founding member of the product and marketing team at Linden Lab, Hunter helped build the noted virtual world Second Life. Earlier, he was a management consultant and also spent a year at Late Night with Conan O'Brien, broadcasting to an audience of insomniacs, truckers and college students. Hunter has a BA in History from Vassar and an MBA from Stanford University.",1286838167
y,y,y,y,m,Michael,Wolf,VP Research,GigaOM Pro,"VP Research, GigaOM Pro",,,speaker,y,"Michael has spent more than 10 years as an industry analyst, starting at In-Stat and launching the company’s consumer networking and digital media research services, and more recently was the digital home practice director for ABI. He has been a columnist for Network World and has written a book on home networking for consumers. At GigaOM Pro, he oversees the overall research efforts and serves as curator for the Connected Consumer. He holds a Master’s in International Management from Thunderbird. Michael's expertise includes: Business of Technology, digital media, home networking, mobile content, online video, video games, social media, online publishing, media markets, pay-TV, pay and online video advertising, mobile advertising, silicon, connected entertainment.",
y,y,y,y,m,Merton ,,Improvisational Pianist,,Improvisational Pianist,,,speaker,y,"Merton is an improvisational pianist and comedic performer who rose to prominence earlier this year as a result of his ChatRoulette Piano Improv videos on YouTube.  His first video has now received over 11 million views, and it became the Highest-Rated YouTube Video of All Time. Merton now focuses on live performances, both in-person and via webcam.  He uses interactive improvisational songs to connect with strangers, and is currently planning to film a series of impromptu street piano performances in various cities around the world.",