Date,Time,Title,Subtitle,Description,Speaker,Speaker Title,Speaker Company,Panelist,Panelist Title,Panelist Company
,,10:20 AM - Citrix Systems Sponsor Workshop - Conference Room 4,IT as a Service is the IT of the future,"Evolving from “keeping the lights on” to delivering IT as a Service (ITaaS) can provide rewards such as greater agility, flexibility and user productivity. Understanding the strategy, planning process and tools for this transformation will help catalyze changes in the way the business operates and deliver real value. Join us to learn about the new ITaaS model and how to begin the transformation. We will provide examples of real enterprises that are delivering ITaaS today.",,,,Krishna Subramanian,"VP of Product Marketing, Cloud Platforms",Citrix Systems
,11:05 AM,Launchpad,"We feature the young and few companies that we think will change things for the many. Come meet them. For company profiles, see the <a href=""http://event.gigaom.com/structure/launchpad/"">LaunchPad page</a>.","<p>Company 1: 28msec</p>
<p>Company 2: AppScale Systems</p>
<p>Company 3: Factor.io</p>
<p>Company 4: Metrica</p>
<p>Company 5: SaltStack</p>
<p>Company 6: Synapsify</p>",Farah Giga,Entrepreneur in Residence,Data Collective Venture Capital (DCVC),Luis Robles,Partner,Sequoia Capital
,,,,,,,,Bipul Sinha,Partner,Lightspeed Venture Partners
,,,,,,,,Ann Winblad,Managing Director,Hummer Winblad Venture Partners
,11:05 AM,GigaOM Research Mapping Session: Conference Room 1,Understanding the multicloud opportunity,"Hybrid clouds, in which one public cloud and one private cloud are used together, are becoming increasingly common solutions to a range of business challenges. This session will explore the motivations behind adopting a multicloud strategy, and it will consider the implications for customers, providers of cloud solutions and providers of cloud management tools and other middleware components.Why does multicloud matter? Is it a trend that will grow or one whose days are numbered?",Paul Miller,"Founder, Cloud of Data and Analyst",GigaOM Research,Ben Kepes,"Industry Commentator, Diversity Limited and Analyst",GigaOM Research
,,,,,,,,David Linthicum,"SVP, Cloud Technology Partners and Analyst",GigaOM Research
,,,,,,,,Jo Maitland,Director,GigaOM Research
,11:40 AM,The rise of the app economy,,"New business initiatives are focused on building interactive customer experiences through the web and mobile apps. Applications and developers are gaining in power and prominence in this new world where the app developer is now viewed as part of the business team. Learn more from this interactive discussion between New Relic CEO and founder Lew Cirne, known as the Coding CEO, and Red Monk analyst Stephen O'Grady, the author of ""The New Kingmakers, How Developers Conquered the World.""",Barb Darrow,Senior Writer,GigaOM,Lew Cirne,Founder and CEO,New Relic
,,,,,,,,Stephen O'Grady,Partner and Principal Analyst,RedMonk
,11:55 AM,Metamorphosis: Everything must go first,,"In this prized talk we get key insights from LinkedIn's top technologist on the massive and complete overhaul of its infrastructure over a few months for one reason: Its customers and the business world demanded it. The world has gone to real time, and so must it. Learn about the challenges and decisons it faced in starting from scratch while still serving 100 million customers.",,,,Kevin Scott,SVP Engineering,LinkedIn
,12:10 PM, Release cycles in a real-time world,,Consumer expectations will not tolerate quarterly release cycles. You have to be able to update and redeploy your application in near real time. This creates challenges for the existing enterprise but asks that it update its operations or lose its customers. Kohl's has tackled the challenge through unique technology vendor choices and a change in developer operations. Come learn from this talk.,,,,Ratnakar Lavu,"SVP, Digital Innovation",Kohl's
,12:25 PM,Cloud trailblazers: 10 for 2013,,"Mitchell Hashimoto, the founder of HashiCorp, talks about building an open-source suite of tools to configure and manage virtual machines.",,,,Mitchell Hashimoto,Founder,HashiCorp
,12:30 PM,LUNCH,,(Optional Workshops - Located on Level 2),,,,,,
,,12:45 PM - Nuage Networks Sponsor Workshop - Conference Room 1,The true potential of network virtualization,"While much has been said about network virtualization, current solutions remain limited to simplistic use cases, restricting services within boundaries of single data centers or virtualized islands. We describe a novel approach that fulfills the promise of massively scalable network virtualization and enables the seamless interconnection of cloud services with existing enterprise environments.",,,,Dimitri Stiliadis,Co-Founder and Chief Architect,Nuage Networks
,,12:45 PM - SAP Sponsor Workshop - Conference Room 2,Not all clouds are created equal: enterprise in-memory clouds,"Everything is not virtualized, OpenStack or consumer-facing webscale applications. Mission-critical enterprise applications and in-memory databases are moving to the cloud, but they introduce a different set of challenges and requirements. In this session, we will highlight the current issues and approaches toward “cloudifying” in-memory systems.",,,,Wesley Mukai,"VP, HANA Cloud Computing",SAP
,,12:45 PM - Kontron Sponsor Workshop - Conference Room 3,How efficient is your cloud? ,Kontron and partners Vantrix and Sensinode take an inside look at two powerful use cases for achieving a new order of magnitude of efficiency with cloud infrastructure. Catch the latest technologies that are driving new cost per performance densities for video and media streaming and M2M and IoT applications in the cloud.,,,,James D. Edson, VP Sales and Business Development,Sensinode
,,,,,,,,Sven Freudenfeld,"Telecom, Cloud Business Development",Kontron
,,,,,,,,Greg Hedgpeth,"Sr. Director, Solutions Architecture",Vantrix 
,,12:45 PM - Junpier Networks Sponsor Workshop - Conference Room 4,Federated cloud networks — achieving scale and interoperability across elastic architectures,"Jennifer Lin will lead a discussion around requirements to achieve interoperable, scalable, secure and resilient virtual private cloud services that can accommodate the most demanding application environments. What are the alternative approaches to cloud networking, and what have we learned to date about virtual overlays and how to balance goals around operational efficiency and business agility? ",,,,Jennifer Lin,"Sr. Director, Product Management",JunosV Contrail
,1:30 PM,Cloud trailblazers: 10 for 2013,,"James Tamplin, the CEO of Firebase, talks about creating a new architecture for building scalable web apps quickly.",,,,James Tamplin,Co-Founder and CEO,Firebase
,1:35 PM,Rethinking hardware development for a software world,,"As software takes over more and more of our infrastructure, customers are expecting hardware development cycles to speed up. After all, when you can deploy code in a day, waiting for silicon to catch up is a drag. Applied Micro CEO Paramesh Gopi shares how he is rethinking hardware development for a software world.",Stacey Higginbotham,Senior Writer,GigaOM,Paramesh Gopi,President and CEO,AppliedMicro
,1:55 PM,The future of storage in a super distributed world,,"As we progress in the world of cloud computing, what does the notion of software-defined storage really mean?  At some point that storage is going to be concrete and meet a hard drive. But will that drive be a spinning platter or will it be an array of SSDs? What happens when memory gets faster and more persistent so that it approaches RAM speed at platter costs? And what happens when we distribute this, not just beyond the box but beyond the data center perimeter while trying to grab on to one cohesive view of it all? Two industry legends in the storage space share their thoughts on storage now and in the future and what impact big data will have on innovation, costs and performance for buyers in the industry.",Barb Darrow,Senior Writer,GigaOM,Scott Dietzen,CEO,Pure Storage
,,,,,,,,Paula Long,Co-Founder and CEO,DataGravity
,2:15 PM,The value of information,,"Most people in IT today believe that data has the highest value, when in reality information is the most valuable resource in IT. Based on research started during the investigation of causes of data gravity, this session explains what gives information value, how information's value is affected, and how to leverage information to maximize outcomes.",,,,Dave McCrory,SVP,Warner Music Group
,2:30 PM,Application-aware networks (when SDN is in its stride),,"Networks were for a long time just thought of as pipes. With the decline in cost of compute and its subsequent proliferation at the heart of networking (SDN) for control and transport we have the emergence of a very powerful beast: a network that is aware of the applications that are running on it and that can adapt itself to the performant delivery of those apps. Responsive apps make happy users, which make the ROI on the deployments worthwhile. What should you be planning for your network infrastructure?",Stacey Higginbotham,Senior Writer,GigaOM,Najam Ahmad,"Director, Technical Operations, Infrastructure",Facebook
,,,,,,,,Vijay Gill,GM,Microsoft
,,,,,,,,Dave Husak,Founder and CEO,Plexxi
,,,,,,,,Pascale Vicat-Blanc,Founder and CEO,Lyatiss
,3:00 PM,Cloud trailblazers: 10 for 2013,,"Narges Bani Asadi, the CEO of Bina Technologies, talks about changing the way medicine works with big data and high-performance computing.",,,,Narges Bani Asadi,Founder and CEO,Bina Technologies
,3:05 PM,BREAK,,(Optional Workshops - Located on Level 2),,,,,,
,,3:20 PM - Microsoft Sponsor Workshop - Conference Room 1,File..new..data center,See how you can create a brand-new data center in less than 50 minutes. Connect back to your enterprise and scale on demand using Windows Azure.,,,,David Aiken,Director,Windows Azure
,,3:20 PM - HGST Sponsor Workshop - Conference Room 2,The overlooked disk drive and the (R)evolution of storage ,"Whether you think about it or not, storage is at the center of your applications, services and data centers — and it’s at the heart of the world’s digital infrastructure. Learn about the future of HDDs and flash and discover new innovations and value propositions that can help improve your bottom line. ",,,,Mike Alexenko ,"Senior Director, Market Development - Cloud and Mobility ",HGST
,,3:20 PM - DataDirect Networks Sponsor Workshop - Conference Room 3,New approaches to performance and efficiency that achieve exceptional cloud-storage economics at scale,Web applications and cloud repositories are driving unprecedented levels of performance and capacity requirements for storage. Current infrastructure can be dramatically wasteful at these levels of scale. The challenges encountered lead to underperforming ROI that can be improved. Please join us for a discussion around these challenges and new solutions.,,,,Tom Leyden,"Director, Product Marketing WOS",DataDirect Networks
,,3:20 PM - New Relic Sponsor Workshop - Conference Room 4,App developers and your corporate strategy,"Apps are popping up by the thousands, and app developers are turning to the cloud. With infrastructure being managed by cloud providers, the focus is on apps with app developers in charge. Join this interactive session with two leaders who will share provocative views on the new role of app developers.",,,,Matthew Baird,VP of Engineering,Ticketfly
,,,,,,,,Lew Cirne,Founder and CEO,New Relic
,,,,,,,,Stephen O'Grady ,Principal Analyst and Co-Founder,RedMonk
,4:05 PM,Cloud trailblazers: 10 for 2013,,"Avinash Lakshman, the founder of Hedvig, talks about rethinking storage for massively distributed architectures.",,,,Avinash Lakshman,Founder,Hedvig
,4:10 PM,Energy blooms at eBay’s innovative data center in Utah: eBay and Bloom Energy,,"The world’s data centers consume more electricity than Sweden and Iran combined. Data centers are facing an energy crisis in the 21st century: As the cloud demands more computing power and customers demand more distributed data centers, energy infrastructure designed for civic use starts to be strained. In this talk we hear for the first time about the innovative energy deployment for the eBay data center in Utah and what it teaches us about the future of energy supply for the cloud.",Ucilia Wang,Contributing Writer,"GigaOM, Forbes and Renewable Energy World",Peter Gross,"VP, Mission Critical Systems",Bloom Energy
,,,,,,,,Dean Nelson,"VP, Global Foundation Services",eBay
,4:30 PM,The curse of the burst       ,,"Gary Grider builds some of the biggest supercomputers for the U.S. government and its agencies. In this session he talks about dealing with bursts of data today. Today his bursts of data are 200 TB in size in 5 minutes, and by the end of the decade they will be 30 PB in 5 minutes. He talks about the effects on his machines, networks and file systems and their impact on his archive technology investment strategy. This talk will hint at problems that will arise for service providers and large compute users in the future.",Derrick Harris,Senior Writer,GigaOM,Gary Grider,HPC Division Leader,Los Alamos National Lab
,4:50 PM,Dark architecture and how to forklift upgrade your infrastructure with zero downtime,,"Everyone’s infrastructure eventually needs an upgrade. However, most companies go about it the wrong way. Flag days — when 100 percent of improvements are switched over on a single day — are still popular, even though they’re ineffective and with the potential for disastrous breakdown. Cory von Wallenstein, the CTO of Dyn, will explain how the company eliminates the risk while still having its service operate at the highest level. In this talk von Wallenstein describes what ""dark architecture"" means and why you should should upgrade your infrastructure a small piece at a time off to the side and then test. This speech can save money, time and headaches. It’s definitely a must-see. ",,,,Dave Connors,"VP, Technical Operations",Dyn
,5:05 PM,"Hacking the cloud: Rethink hardware, rethink app delivery, turn off your instances and save money",,"We are seeing some early signals for new product categories. In the cloud, where you can pick and choose your infrastructure, you can optimize on performance and cost. We assemble some of the alpha technologists and hackers out there to talk about how they are hacking together bespoke solutions to optimize and save money on their infrastructure and how their actions extrapolate a line for future infrastructure products, as well as trends that you should be looking out for.",Derrick Harris,Senior Writer,GigaOM,Gleb Budman,Co-Founder and CEO,Backblaze Online Backup
,,,,,,,,Adrian Cockcroft,Cloud Architect,Netflix
,5:25 PM,CLOSING REMARKS,,,,,,Stacey Higginbotham,Senior Writer,GigaOM
,,,,,,,,Om Malik,Founder and Senior Writer,GigaOM
,5:30 PM,HP CLOUD SERVICES COCKTAIL RECEPTION ,,,,,,,,